{
  "id": "laws-0380",
  "title": "上市公司实际控制人法律责任的反思与构建",
  "discipline": "minshang",
  "fully_read": true,
  "central_claim_id": "C1",
  "source": {
    "pdf": "markdown/上市公司实际控制人法律责任的反思与构建.md",
    "paragraph_index": "examples/laws-0380/laws-0380.paragraphs.json",
    "citations": "examples/laws-0380/laws-0380.citations.json"
  },
  "nodes": [
    {
      "id": "Q1",
      "type": "problem",
      "proposition_type": "evaluative",
      "text": "现行“追首恶”监管借用了不相称的股东受信义务理论，片面放大实际控制人可追责的一面，反而模糊了其与上市公司应有的责任边界。",
      "source_anchor": {
        "page": 1,
        "paragraph_id": "P0002",
        "quote": "错误地援用了控股股东信义义务理论，过于强调实际控制人的可追责性",
        "cite_id": "cite_self"
      }
    },
    {
      "id": "C1",
      "type": "claim",
      "proposition_type": "normative",
      "text": "证券法对实际控制人责任的安排，应改换其理论基础，把重心放在董事责任之上。",
      "source_anchor": {
        "page": 1,
        "paragraph_id": "P0002",
        "quote": "构建以董事责任为主的追责体系",
        "cite_id": "cite_self"
      }
    },
    {
      "id": "P1",
      "type": "premise",
      "proposition_type": "descriptive",
      "text": "公司法上的控股股东责任强调控股股东对公司整体利益的维护，证券法上的实际控制人责任关注公众投资者不因非法控制或欺诈承受证券价值损失，两者逻辑不同。",
      "source_anchor": {
        "page": 1,
        "paragraph_id": "P0002",
        "quote": "公司法上的控股股东责任强调的是控股股东对于公司整体利益的维护",
        "cite_id": "cite_self"
      }
    },
    {
      "id": "P2",
      "type": "premise",
      "proposition_type": "descriptive",
      "text": "股东完成出资后与公司、股东之间不存在财产管理上的委托代理关系，普通法语境下并无控股股东对公司或非控股股东承担信义义务的衡平法基础。",
      "source_anchor": {
        "page": 1,
        "paragraph_id": "P0006",
        "quote": "在普通法的语境下，并无控股股东对公司或者非控股股东承担信义义务的衡平法基础",
        "cite_id": "cite_self"
      }
    },
    {
      "id": "P3",
      "type": "premise",
      "proposition_type": "descriptive",
      "text": "美国各州成文法均无控股股东对非控股股东承担法定信义义务的规定，法院对控股股东与非控股股东信义关系的认定也持保守态度。",
      "source_anchor": {
        "page": 1,
        "paragraph_id": "P0006",
        "quote": "美国各州在成文法层面均无控股股东对于非控股股东承担法定信义义务的规定",
        "cite_id": "cite_self"
      }
    },
    {
      "id": "P4",
      "type": "premise",
      "proposition_type": "evaluative",
      "text": "“追首恶”语境下实际控制人信义义务被指向对中小投资者（而非公司）的义务，混淆了公司法与证券法上股东责任的要求与要件，扩张了股东信义义务的范围。",
      "source_anchor": {
        "page": 1,
        "paragraph_id": "P0005",
        "quote": "混淆了公司法与证券法上关于股东责任的要求以及股东责任要件的区别",
        "cite_id": "cite_self"
      }
    },
    {
      "id": "P5",
      "type": "premise",
      "proposition_type": "evaluative",
      "text": "2019年证券法的过错推定责任把上市公司违法行为直接推定为实际控制人控制的结果，是人格混同而非人格独立的“有罪推定”，与公司法人人格独立要求冲突。",
      "source_anchor": {
        "page": 1,
        "paragraph_id": "P0010",
        "quote": "证券法直接把上市公司（发行人）的违法行为推定为实际控制人控制的结果",
        "cite_id": "cite_self"
      }
    },
    {
      "id": "P6",
      "type": "premise",
      "proposition_type": "descriptive",
      "text": "依董事会中心主义，公司意思由董事会生成，董事对公司负有忠实勤勉义务，故治理上应压实董事责任而非扩大股东受信义务。",
      "source_anchor": {
        "page": 1,
        "paragraph_id": "P0009",
        "quote": "董事（会）中心主义强调董事会是公司意志的来源",
        "cite_id": "cite_self"
      }
    },
    {
      "id": "P7",
      "type": "premise",
      "proposition_type": "descriptive",
      "text": "美国证券法将实际控制人直接参与或引发违法行为视为等同公司行为，令其承担证券法上的直接责任（一因一果），而非连带责任（多因一果）。",
      "source_anchor": {
        "page": 1,
        "paragraph_id": "P0011",
        "quote": "实际控制人承担的是等同于公司责任的主要责任",
        "cite_id": "cite_self"
      }
    },
    {
      "id": "E1",
      "type": "evidence_statute",
      "text": "2005年公司法第20条禁止控股股东以滥权方式侵害公司或其他出资人的利益，第152条另设股东派生诉讼作为救济路径。",
      "source_anchor": {
        "page": 1,
        "paragraph_id": "P0003",
        "quote": "不得滥用股东权利损害公司或者其他股东的利益",
        "cite_id": "cite_self"
      }
    },
    {
      "id": "E2",
      "type": "evidence_case",
      "text": "Windmuller 案表明，一名股东即使握有压倒性多数股份，也不因此对其他股东负有受托义务。",
      "source_anchor": {
        "page": 1,
        "paragraph_id": "P0006",
        "quote": "股东仅仅持有绝大多数股份并不使其成为其他股东的受托人",
        "cite_id": "cite_self"
      }
    },
    {
      "id": "E3",
      "type": "evidence_case",
      "text": "Central Bank of Denver 案认定美国证券法从未明示规定协谋和教唆的连带责任，法定责任直接指向单一行为人。",
      "source_anchor": {
        "page": 1,
        "paragraph_id": "P0011",
        "quote": "从来没有明示规定所谓的协谋和教唆的连带责任",
        "cite_id": "cite_self"
      }
    },
    {
      "id": "E4",
      "type": "evidence_case",
      "text": "匹凸匹信息披露违法违规案中，证监会依据“双重身份理论”对实际控制人采取双罚措施。",
      "source_anchor": {
        "page": 1,
        "paragraph_id": "P0003",
        "quote": "对涉案公司的实际控制人采取了双罚措施",
        "cite_id": "cite_self"
      }
    },
    {
      "id": "L1",
      "type": "counter_position",
      "text": "理论界认为实际控制人滥用控制权牟取私利会侵害公众投资者，由此推导需要加大对公司控制股东或实际控制人的规制（“追首恶”的诚信义务理论）。",
      "source_anchor": {
        "page": 1,
        "paragraph_id": "P0004",
        "quote": "加大对公司控制股东或者实际控制人的规制",
        "cite_id": "ref-l1-cited"
      }
    },
    {
      "id": "L2",
      "type": "counter_position",
      "text": "本土化的股东受信义务学说，主张顺从实践现状、赋予控股股东在治理架构里的主导角色，并把受信义务推及证券监管领域。",
      "source_anchor": {
        "page": 1,
        "paragraph_id": "P0005",
        "quote": "确立控股股东在公司治理中的主体地位",
        "cite_id": "ref-l2-cited"
      }
    },
    {
      "id": "N1",
      "type": "normative_conclusion",
      "text": "当实际控制人以控制公司方式损害公司利益时，其承担事实董事角色，非控股股东可通过股东派生诉讼追究其违反董事信义义务的责任。",
      "source_anchor": {
        "page": 1,
        "paragraph_id": "P0002",
        "quote": "当实际控制人以控制公司的方式损害公司利益时，其承担的是事实董事的角色",
        "cite_id": "cite_self"
      }
    },
    {
      "id": "N2",
      "type": "normative_conclusion",
      "text": "如果此类控制导致证券法上的违法后果，实际控制人应作为法定违法行为人之一承担直接责任（而非连带责任）。",
      "source_anchor": {
        "page": 1,
        "paragraph_id": "P0002",
        "quote": "如果此类控制导致了证券法上的违法后果，则实际控制人应作为法定的违法行为人之一承担直接责任",
        "cite_id": "cite_self"
      }
    },
    {
      "id": "N3",
      "type": "normative_conclusion",
      "text": "证券法应将实际控制人侵害特定出资人权益与侵害公司整体权益两类行为分开处理，并允许其他股东提起派生诉讼，且不设持股期限与比例的资格门槛。",
      "source_anchor": {
        "page": 1,
        "paragraph_id": "P0012",
        "quote": "在证券法中区分实际控制人对特定股东的损害与对公司整体利益的损害两种不同行为类型",
        "cite_id": "cite_self"
      }
    },
    {
      "id": "N4",
      "type": "normative_conclusion",
      "text": "通过司法解释变通证券法第85条连带责任追责顺序，将实际控制人认定为诉讼意义上的主犯，鼓励投资者首先追究其董事责任。",
      "source_anchor": {
        "page": 1,
        "paragraph_id": "P0013",
        "quote": "鼓励投资者首先对实际控制人追究证券法意义上的董事责任",
        "cite_id": "cite_self"
      }
    }
  ],
  "edges": [
    {
      "from": "Q1",
      "to": "C1",
      "relation": "motivates",
      "warrant": "追首恶错用控股股东信义义务理论、模糊责任边界，这一弊病构成问题，促使转换理论基础、构建董事责任为主的追责体系"
    },
    {
      "from": "P1",
      "to": "C1",
      "relation": "supports",
      "warrant": "公司法与证券法责任逻辑不同，证券法责任不能简单归结为公司法控股股东信义义务的延伸，故须转换理论基础"
    },
    {
      "from": "P2",
      "to": "C1",
      "relation": "supports",
      "warrant": "普通法本无控股股东对非控股股东的信义义务基础，追首恶援用控股股东信义义务缺乏公司法根基，故应转向董事责任"
    },
    {
      "from": "P3",
      "to": "C1",
      "relation": "supports",
      "warrant": "美国成文法与司法均不承认控股股东对非控股股东的法定信义义务，进一步否定追首恶的理论前提，支持转向董事责任"
    },
    {
      "from": "P4",
      "to": "C1",
      "relation": "supports",
      "warrant": "追首恶将信义义务扩张为对中小投资者义务、混淆公司/证券法股东责任，故须厘清边界并转换理论基础"
    },
    {
      "from": "P5",
      "to": "C1",
      "relation": "supports",
      "warrant": "过错推定是人格混同的有罪推定、与法人人格独立冲突，故须转换理论以避免法人人格混同"
    },
    {
      "from": "P6",
      "to": "C1",
      "relation": "supports",
      "warrant": "董事中心主义下落实董事责任才是治本，故应构建以董事责任为主的追责体系"
    },
    {
      "from": "P7",
      "to": "N2",
      "relation": "supports",
      "warrant": "美国证券法提供直接责任（一因一果）的归责范式，为证券法路径采直接责任而非连带责任提供经验支撑"
    },
    {
      "from": "E1",
      "to": "P1",
      "relation": "supports",
      "warrant": "公司法第20条、第152条表明公司法以控股股东义务与股东派生诉讼维护公司利益，佐证公司法责任逻辑侧重公司整体利益"
    },
    {
      "from": "E2",
      "to": "P3",
      "relation": "supports",
      "warrant": "Windmuller案判例直接证明股东持多数股份不成为其他股东受托人，佐证美国司法不承认控股股东对非控股股东信义义务"
    },
    {
      "from": "E3",
      "to": "P7",
      "relation": "supports",
      "warrant": "Central Bank案判定证券法不存在以两个行为为要件的连带责任、直接指向单一行为人，佐证美国证券法直接责任范式"
    },
    {
      "from": "E4",
      "to": "Q1",
      "relation": "illustrates",
      "warrant": "匹凸匹案双重身份理论双罚实际控制人，例证追首恶监管方式的实际运作与可追责性导向"
    },
    {
      "from": "L1",
      "to": "C1",
      "relation": "attacks",
      "warrant": "追首恶理论主张实际控制人对中小投资者负诚信义务、加大对其规制，与作者以董事责任为主的构建方向冲突"
    },
    {
      "from": "L2",
      "to": "C1",
      "relation": "attacks",
      "warrant": "本土化解释主张确立控股股东主体地位、将股东信义义务扩张用于证券监管，与作者限缩股东信义义务扩张的核心主张冲突"
    },
    {
      "from": "C1",
      "to": "N1",
      "relation": "derives",
      "warrant": "构建董事责任为主的追责体系，在公司法层面表现为实际控制人以控制损害公司利益时承担事实董事角色、经股东派生诉讼追责"
    },
    {
      "from": "C1",
      "to": "N2",
      "relation": "derives",
      "warrant": "董事责任为主的追责体系在证券法层面表现为实际控制人作为法定违法行为人承担直接责任"
    },
    {
      "from": "C1",
      "to": "N3",
      "relation": "derives",
      "warrant": "为保障非控股股东诉权选择，须在证券法区分两类损害、赋予其他股东派生诉讼权"
    },
    {
      "from": "C1",
      "to": "N4",
      "relation": "derives",
      "warrant": "追责体系落地需司法解释变通第85条连带责任顺序，将实际控制人认定为诉讼意义上的主犯以追究其董事责任"
    }
  ]
}